<?xml version="1.0" encoding="UTF-8"?>
<xs:schema xmlns:xs="http://www.w3.org/2001/XMLSchema" elementFormDefault="qualified"  attributeFormDefault="unqualified">
	<xs:element name="Orders" type="orders" />
	
	<xs:complexType name="orderdetail">
		
			<xs:sequence>
				
					<xs:element name="name" type="xs:string"/>
					
					<xs:element name="number">
						<xs:simpleType>
							<xs:restriction base="xs:integer">
								<xs:minInclusive value="0"/>
								<xs:maxInclusive value="120"/>
							</xs:restriction>
						</xs:simpleType>
					</xs:element>
					
					<xs:element name="city" type="xs:string"/>
					
					<xs:element name="zip">
						<xs:simpleType>
							<xs:restriction base="xs:integer">
								<xs:pattern value="[0-9][0-9][0-9][0-9][0-9]"/>
							</xs:restriction>
						</xs:simpleType>
					</xs:element>
				
			</xs:sequence>
			
		<xs:attribute name="orderDate" type="xs:date"/>
					<xs:attribute name="orderId">
						<xs:simpleType>
							<xs:restriction base="xs:string">
								<xs:pattern value="A[0-9][0-9][0-9]"/>
							</xs:restriction>
					</xs:simpleType>
		</xs:attribute>
	</xs:complexType>
	
	<xs:complexType name="orders">
		<xs:sequence>
		
			<xs:element name="Order" minOccurs="1" maxOccurs="unbounded" type="orderdetail">
			
			</xs:element>
			
		</xs:sequence>
		
		
		
		
	</xs:complexType>
					
	
	
	
</xs:schema>
